{
  "type": "slip",
  "version": "1",
  "network": "mainnet",
  "icon": "https://linktap.example/i/voting-power.svg",
  "title": "Delegate your voting power",
  "description": "Choose a delegate representative. Your ADA never moves and stays fully spendable.",
  "label": "Delegate voting power",
  "disabled": true,
  "reason": { "message": "Delegation is paused until the next epoch boundary." },
  "links": {
    "actions": [
      { "label": "Delegate to drep1wqz…", "href": "/api/slips/drep/delegate?drep=drep1wqz", "disabled": false }
    ]
  }
}
